{
  "event_id": "evt-b-002",
  "run_id": "visible-run-b",
  "experiment_id": "exp-visible-a",
  "graph_digest": "0000000000000000000000000000000000000000000000000000000000000000",
  "policy_version": "2026.1",
  "schema_version": "2.16.2",
  "status": "FINISHED",
  "occurred_at": "2026-01-10T11:30:00Z",
  "metrics": {"accuracy": 0.91},
  "artifact_digest": "bbbbbbbbbbbbbbbbbbbbbbbbbbbbbbbbbbbbbbbbbbbbbbbbbbbbbbbbbbbbbbbb"
}
